{
  "id": "example-gpt-4o-mini-20260519",
  "benchmark_id": "touhouqa-core-v1",
  "model": "GPT-4o mini (example)",
  "model_id": "gpt-4o-mini",
  "organization": "Example Org",
  "parameters_billion": null,
  "tier": "community",
  "metrics": {
    "accuracy": 0.0,
    "correct": 0,
    "total": 2536,
    "missing_predictions": 0,
    "extra_predictions": 0
  },
  "breakdown": {
    "by_domain": {
      "character": { "accuracy": 0.0, "correct": 0, "total": 0 },
      "music": { "accuracy": 0.0, "correct": 0, "total": 0 },
      "work": { "accuracy": 0.0, "correct": 0, "total": 0 },
      "spellcard": { "accuracy": 0.0, "correct": 0, "total": 0 },
      "other": { "accuracy": 0.0, "correct": 0, "total": 0 }
    }
  },
  "run": {
    "touhouqa_repo_commit": "0000000",
    "eval_command": "python eval.py --gold <hidden> --predictions predictions.jsonl --report-out eval_report.json",
    "inference": {
      "provider": "openai-compatible",
      "api_base": "https://api.openai.com/v1",
      "model_id": "gpt-4o-mini",
      "temperature": 0,
      "max_tokens": 64,
      "prompt_template_id": "touhouqa-v1-zh-short",
      "prompt_sha256": "0000000000000000000000000000000000000000000000000000000000000000"
    },
    "seed": 0,
    "completed_at": "2026-05-19T00:00:00Z"
  },
  "artifacts": {
    "predictions_path": "submissions/example/predictions.jsonl",
    "predictions_sha256": "0000000000000000000000000000000000000000000000000000000000000000",
    "eval_report": "submissions/example/eval_report.json",
    "eval_report_sha256": "0000000000000000000000000000000000000000000000000000000000000000",
    "repository_url": "https://github.com/example/TouhouQA"
  },
  "status": "pending",
  "submitted_at": "2026-05-19T00:00:00Z",
  "verified_at": null,
  "notes": "Placeholder for schema validation only — not a real score."
}
